"","forum_text","sentiment_score","negative"
"978","Thanks o/ I actually have no idea if the gap was wide enough for me to fall, but hey, it looked kinda cool, may as well share it lol",0.5,"FALSE"
"979","Damn! That one is even more pro! ",-1,"TRUE"
"980","I hope he comes back, his bastion plays are insane!",-1,"TRUE"
"981","Well darn I’m late to the party. I don’t watch streams but I like seeing his posts on here ",1,"FALSE"
"982","I don't follow or watch streams but I guess I subscribe to him on youtube. He's nasty ",-1,"TRUE"
"983","What are physics. Nice play",1,"FALSE"
"984","There’s a Hanzo fall/ledge climb dodge like this that I also need to master.",0.333333333333333,"FALSE"
"985","Good breaking hooks as well",0.333333333333333,"FALSE"
"986","You people say IQ so damn much that it's completely lost its original meaning to me",-1,"TRUE"
"987","True but you need to remember that it is obviously just a joke. So chill",-1,"TRUE"
"988","500 iq dodge into 30 iq right click",1,"FALSE"
"989","You haven't played enough flankers then",1,"FALSE"
"990","Yup...support main here lol",1,"FALSE"
"991","If she gets good there’s a bit of a market for that. I know of people who’ve bought custom painted Joycons for their Switch from Etsy so I imagine custom painted Xboxes are a thing too.Awesome job too, it looks very close to the actually one.",1,"FALSE"
"992","sweet",1,"FALSE"
"993","I thought they haven't announced any of the winners yet",1,"FALSE"
"994","It's a Social Media competition, the winners are always those with the largest following.",1,"FALSE"
"995","Really? That's lame I thought it was going to be something truly random like it said.....",0,"FALSE"
"996","that's pretty awesome!",1,"FALSE"
"997","That looks awesome!",1,"FALSE"
"998","Just out of curiosity how much would you be OK with paying someone to customize your Xbox for you? I’m not considering putting my sister to work or anything lol. Just wondering ",1,"FALSE"
"999","BzZzZzZzW1: Hello!BzZzZzZzW2: Hi there!BzZzZzZzW1: How embarrassing!BzZzZzZzW2: Sorry about that!BzZzZzZzW1 hit by Scatter Arrow",-1,"TRUE"
"1000","It's not out of nowhere, it's just that the first 10 arrows are nearly silent because they all whiffed.",1,"FALSE"
"1001","Every time I see a kill feed from a Hanzo where he misses half his shots then hits with the scatter arrow I can't help but feel bad for them. I'm terrible at aiming with Hanzo personally so I fully understand all those whiffs ",-1,"TRUE"
"1002","Eh, sometimes you’re just fishing, especially at distance. Some of my favorite shots in DM are when you see two players ineffectually fighting each other across the map and you just hang out shooting arrows into the fray until the inevitable dink",-0.5,"TRUE"
"1003","Inevitable you say?",-1,"TRUE"
"1004","With my ping I think the server just gives me the benefit of the doubt sometimes.",0,"FALSE"
"1005","I and every other Tracer main hate you.",-1,"TRUE"
"1006","It’s not me you’re after. I know Hanzo is supposed to be able to handle tracer but every one I meet knows to blink just as I’m lining up a shot. If my scatter is on cool down I usually just get melee’d to death in shame.",-0.333333333333333,"TRUE"
"1007","The other day I was firing off some arrows at a winston fighting someone. Someone else starts attacking me so I stop shooting the winston. All of a sudden I hear DINK and the winston dies saying, “WOW”.Apparently my sonic arrow landed on his bubble and fell down and headshot him after the bubble ran out.",-0.333333333333333,"TRUE"
"1008","Most accurate comment I’ve read in a while",1,"FALSE"
"1009","Not really, Sym vs Sym is a who has more patience to wait inside your trap",0,"FALSE"
"1010","Sym vs Sym = who is the better baiter",1,"FALSE"
"1011","Who is the master baiter*",1,"FALSE"
"1012","Im a decent baiter, my cousin Moes, now thats a master baiter. ",1,"FALSE"
"1013","Day 100:  both dead from lack of food.",-1,"TRUE"
"1014","In terms of beam battle, whoever locks on first wins typically. And throwing your shield is a bad decision at it lets them build charge on it first before locking onto you. ",0,"FALSE"
"1015","only if they can build charge on the shield while staying out of your range - you can still target them through your shield, so they won't build up charge faster than you.",1,"FALSE"
"1016","Also its worth it to use the shield after they have been hitting you for a bit already and have built some charge.",1,"FALSE"
"1017","That one was the worst in 1v1 gamemode; they removed him from the pool now.Whoever managed to leap on top of the other Winston had the lead, that was the meta I think. I don't think melee'ing had a purpose.",0.333333333333333,"FALSE"
"1018","Spamming melee while holding down the primary has the same dps as holding down primary without melee. This effectively made your clip last longer, and your opponent would reload before you do.It also helps get rid of the first chunk of armor health faster and the last 25 bit of health slightly faster.",0.5,"FALSE"
"1019","Also if you melee away their last chunk of health it would be slightly faster since the damage is applied instantly. ",0.333333333333333,"FALSE"
"1020","Fairly sure meleeing also ignores the damage reduction from armour.",0,"FALSE"
"1021","My understanding was that armor halves the damage taken per hit, up to a max of 5. That makes it really effective against Tesla cannon, which is essentially many small hits of low damage. Armor affects melee less strongly, because it is a larger burst of damage in a single hit.",-0.5,"TRUE"
"1022","That seems reasonable.",1,"FALSE"
"1023","It's the same reason Pharah and Junkrat don't really care about armor while Tracer and Soldier lose a lot of damage to it. ",-1,"TRUE"
"1024","Reminds me more of Paladin vs Paladin in WoW back in the day. Shit dmg + quick easy healing = infinite duels ",0.333333333333333,"FALSE"
"1025","Then right before one of you dies, bubblehearth",0,"FALSE"
"1026","This is why I simply run from Moira unless I feel I can kill her before the sustain-fest begins.Same thing with roadhog tbh.",-1,"TRUE"
"1027","naw roadhog has more mind games (if you are talking hog vs hog).  you can cancel his take a breather with a hook.  It stops the damage reduction too. ",-1,"TRUE"
"1028","Securing an all me kill on roadhog as doomfist is one of the better feelings I get on deathmatch",0,"FALSE"
"1029","Fighting a good Roadhog as Doomfist is one of the most stressful and exciting things. Winning those fights is extremely rewarding ",0.6,"FALSE"
"1030","Same when your playing a roadhogg against a doomfist. It's a fun match up. ",1,"FALSE"
"1031","I play a lot of Roadhog as well, and hooking a doomfist mid-siesmic slam is nice",1,"FALSE"
"1032","I haven't done that yet. It sounds fun. ",1,"FALSE"
"1033","""Oh you're healing TOO BAD MEET THE WALL""",-1,"TRUE"
"1034","I love hooking Doomfist as he attempts to charge me. Like, you want over here? Ok, come to papa.",1,"FALSE"
"1035","That's why you don't punch a hog that isn't doing anything other than reloading or healing",-1,"TRUE"
"1036","And more importantly, his heal, or am I missing something?Nevermind, I can't read apparently.",1,"FALSE"
"1037","He probably meant roadhog vs moira, which is a surprisingly even match often coming down to which team helps their hero first.",1,"FALSE"
"1038","Lucio vs lucio, if there are no edges to boop each other off we might as well just part ways. ",1,"FALSE"
"1039","As Lucio I feel like I can't win duels vs Moira. Her kit just negates Lucio's. Her slight HPS while damaging seems better and more consistent than Lucio (as his requires aim), his boop is negated by her blink, and her ball just does too much damage. Often when I do feel like I could kill her she has ult and just wrecks me :-/",0.25,"FALSE"
"1040","Yeah, in one on one Lucio can't really take her out efficiently and she mostly bypasses his main form of defense (being hard as hell to hit).She's absolutely a Lucio counter when it comes to facing off against one another.  Better to run (in DM) or get teammates instead of risk it imo.",-0.2,"TRUE"
"1041","Can't you just out dance her? That's my go to move with Lucio, oh you think you can kill me? Well watch these MOVES!",0,"FALSE"
"1042","Her RMB is pretty easy to aim (at least on PC) and if you are sticking with speed, you won't live long. Unless your goal is to run (which is what I suggest)",1,"FALSE"
"1043","TBH it's pretty easy on console too. Especially if you adjust the aim assist window to the size of her lock-on",1,"FALSE"
"1044","It's possible but requires some intense dancing! If you can track well with her it's really easy to just stay on target with Lucio even with him jumping around, and her Orb will chew through his health unless he can get away from it which just leaves him open for her to track him.",0.333333333333333,"FALSE"
"1045","At least you can heal through her ult. ",1,"FALSE"
"1046","I think if it's the boosted heal you would be fine, but if she is able to track you well enough I'm not sure the base healing would be enough. The ult is weak damage wise but it's not THAT weak.",0.333333333333333,"FALSE"
"1047","That's what I meant. You can usually amp through it. And then I get in her face so she starts trying to kill me with it instead of healing her team. Do the same thing to Orisas. Just boop em around and shoot em in the head till they die. ",-1,"TRUE"
"1048","I THINK? Don't quote me on this as I'm not a math wizard, but I think as long as you're somewhat aware of Lucio shooting at you and trying to avoid some of the shots you can self heal more than he can do damage to you while ulting unless he's getting all head shots. I usually stay focused on whatever I'm focused on rather than trying to hit him because the actual hit box on the beam is atrocious and incredibly difficult to hit smaller targets with unless you're quite a way away from them.",-0.2,"TRUE"
"1049","Oh you totally can, you really shouldn't ever lose a 1v1 against Lucio as Moira unless the Lucio double bursts you with headshots. But I count on the pettiness of players to try and kill me while I mess with them haha. It's more of ""hey, hey, over here, look at me and not your team"" type of thing. ",-1,"TRUE"
"1050","I mean, Lucio in 1:1 isn't really outclassing anyone with his kit right?Yeah, the boops are sweet though. ",1,"FALSE"
"1051","This is why I only play junkrat in FFA DM. Need to secure kills with some burst damage (instead of getting 1000 assists). Out of all the common picks in this mode I hate roadhog and DVa. Especially DVa. So much effort to de-mech her only for me to die and have someone steal my kill. ",-0.714285714285714,"TRUE"
"1052","Funny enough I never see anyone beside myself play D.va in this mode. With the addition of those rockets, she's pretty much guaranteed a kill or two before losing her much.",-0.2,"TRUE"
"1053","Yeah, Junkrat is a nice safe pick when you want to constantly secure final kills (at least at a 1 kill to 1 death rate at least).I ignore D.Va if I can and instead use her to lure weaker enemies into exposing themselves and giving me the advantage.I am also one of the players who steals the baby D.Va kills, sorry.",-0.538461538461538,"TRUE"
"1054","I straight up avoid Moira 1v1's if the enemy Moira is at full health. The sheer amount of time wasted while we slowly tickle each other  is sad. And my team is usually dead by the time I finish. ",-0.666666666666667,"TRUE"
"1055","Same with pharah 1v1's. Dancing around in the sky trying to see who can lead and weave better than the other just about guarantees one of you is going to get picked off by a hitscan before one of you kills the other",0.333333333333333,"FALSE"
"1056","I loooove when enemy Pharahs focus me when I'm Pharah. Occasionally they'll actually get a hit but usually only after I've killed like 5 of their teammates, thanks for not shooting mine!",-0.333333333333333,"TRUE"
"1057","I'm one of those Pharahs that focus on other Pharahs, mostly because I have 300 hours under Pharah (one trick pony) and I kill them under 5 seconds. Soooo satisfying.",-0.333333333333333,"TRUE"
"1058","I usually only go after the enemy Moira if I desperately need to take out the healer or I know I can make use of my Orb on her. Otherwise I'm better off attacking literally anyone else as Moira",-0.333333333333333,"TRUE"
"1059","exactly. I'll tickle her to distract her, but will only fully engage if I know I have the upper hand and can quickly take her out.",0,"FALSE"
"1060","Yep. This is especially a thing in FFA.If your goal in FFA is just fighting, nothing wrong with Moira vs Moira, but if your goal is win or at least get top 4, you're going to want to avoid tons of ""time wasting"" fights. Like, zapping a Roadhog to death as Moira takes so long, you could've killed like 3 other people in that time.",0,"FALSE"
"1061","perfectly symmetrical violence solves nothing!",1,"FALSE"
"1062","Since we're identical, I know all her moves. That gives me an advantage.",1,"FALSE"
"1063","Neat. ",1,"FALSE"
"1064","Clearly Harry Potter",1,"FALSE"
"1065","Pff. You kids and your fancy spells.Back in my day, all we needed to deliver a payload was Cure Light Wounds and Sticks to Snakes, and the snakes were tiny and mild tempered!",0.333333333333333,"FALSE"
"1066","Don't forget good ol Bigsbys giant hand. ",1,"FALSE"
"1067","And surely we aren't forgetting Otto's Irresistible Dance!!",1,"FALSE"
"1068","This guy Critical Roles.",-1,"TRUE"
"1069","Don't forget my favorite, Mage Hand. So many hijinks",1,"FALSE"
"1070","My next PC is a goblin trickster rogue who's obsessed with trash. I'm gonna have some fun with mage hand. ",-0.333333333333333,"TRUE"
"1071","Nah, otherwise it would take 6 hours between each attack.",-1,"TRUE"
"1072","Speaking of Dragon Ball, I'm actually looking forward to the next episode of Super. Besides Goku v Jiren round 2, I'm pumped because their next foe, Aniraza looks like he'll give everyone a hard time, even Frieza.",0,"FALSE"
"1073","The fact that Frieza is doing something again makes me excited for the episode alone ",1,"FALSE"
"1074","Better Gfycat LinksIn the future, please consider using the Gfycat direct URL format on this subreddit. To do so, simply remove the extra terms between your Gfycat's RandomlyGeneratedName and the domain. Your link should look like this:https://gfycat.com/QuarrelsomeCourteousEnglishsetterI am a bot, and this action was performed automatically. Please contact the moderators of this subreddit if you have any questions or concerns.",0.333333333333333,"FALSE"
"1075","Is this ever going to be enforced? I'd really like it to be.",1,"FALSE"
"1076","Same. Automatically removing posts with incorrect links and informing the posters on how to fix them for resubmission would be a massive improvement.",0,"FALSE"
"1077","Good bot",1,"FALSE"
"1078","Moira 1: I have school in 2 hoursMoira 2: My laptop battery is dying soon.",-1,"TRUE"
"1079","""A warrior's greatest weapon... is patience.""",1,"FALSE"
"1080","I once won a Starcraft 2 ladder match because we wound up in a true stalemate. He had lost the last of his structures that could produce air units, as well as the structures or units necessary to make new structures. Meanwhile, as Terrans, I had lost everything but a Command Center that I had floated into the void at the corner of the map, leaving it inaccessible to him. When he realized the situation that we were in:Him: ""So, what happens now?""Me: ""I dunno. I've got work, so I'll see you in 8 hours.""I came home to a victory screen.",0,"FALSE"
"1081","Moira in deathmatch generates unparalleled amounts of salt. I have a special hatred for her in that mode",0,"FALSE"
"1082","She is the lowest bottom feeder in deathmatch FFA. Diceroll killsteal orbs, invincible escape on 6s cooldown, barely aimed lifesteal, topped off with a ""screw everyone fighting in front of me"" ult. I hate her existence in that mode so much she gets all of my solo ults. ",0,"FALSE"
"1083","After having a game with 2 very persistent Moiras, I avoid deathmatch/ffa like the plague. It just won't go back to normal unless some adjustments are made.",0,"FALSE"
"1084","angle your healing orb towards the ground, it'll go away from you slower thus stay near you longer.",-1,"TRUE"
"1085","This is only good if you are standing still like this. If you can move you should just follow it instead of making it fly away into the sky",1,"FALSE"
"1086","Really, you should be bouncing it off of the nearest wall that's perfectly parallel to you.",1,"FALSE"
"1087","Also useful in corridors, if you're careful you can get the or to bounce in one place. Can use it like a junkrat trap to know if someone is flanking or leave someone in the back lines a mobile health pack.",0.333333333333333,"FALSE"
"1088","The worst part of fighting Moira is the stupid amount of crap on your screen.  There's the beachball of doom bouncing around in your face making that noise, then the lifesteal that autoaims on you which also obscures your view, then the kamehameha beam in your face.  It's like fighting a lifesteal symmetra that can teleport to keep up with your juking, while being forced to wear a blindfold.",-0.714285714285714,"TRUE"
"1089","Her gun is NOT auto aim. It has a generous attach range but it's definitely not auto and will instantly stop attacking if you move out of the area it can latch onto you. Where as Symmetra can stay latched on for a moment even around corners due to latency and the way the game handles attacks. The only thing in her kit that is auto aim is the orb and with the change to it, it currently will auto consume itself on shields and mei walls so you can completely waste the orb for your team if using either of those things.",-0.2,"TRUE"
"1090","Yeah. On the Zarya-Symmetra beam spectrum, Moira's beam feel more like Zarya than Symmetra.",1,"FALSE"
"1091","If it were on a scale of 1-10, Zarya being 1 and Symmetra being 10 it's probably a 3-4 maybe? It's generous on WHEN It attaches, but it's very strict on keeping on someone. You still need to track with it to keep the damage going, just not as much as Zarya does.",-0.333333333333333,"TRUE"
"1092","Have to agree with this. Zarya is a better comparison.",1,"FALSE"
"1093","I feel like this is semantics but she definitely has auto aim. The attach range you are speaking about is auto aim because it automatically aims within that range. I think that her range on that grip is entirely too long as well. ",1,"FALSE"
"1094","You still need to track with it. Symmetra once locked onto someone can just run towards them and it will keep attached to them as long as they are in range and she is looking at them. With Moira unless the person is RIGHT on top of you, you have to track them with the beam to do a constant stream of damage, otherwise it's just chip damage since it won't stay attached. As for the range, it does 50 dps and you can get out of her aim or force her to move by shooting back at her. It's not really going to win a fight unless you can't aim well enough to hit her in return since every hero in the game can out dps her unless they have an orb on them as well.",0.555555555555556,"FALSE"
"1095","Meh her damage is awful and if she had reduced reach it would be much harder to charge her healing. I think she is in a good place right now any slight nerf could really hurt her. ",-0.2,"TRUE"
"1096","I agree that her damage isnt terrible high but with her damage comes self heals greatly increasing her sustain while doing damage. I really think they dont need to nerf her damage or anything other than the distance of which that grip can hold. She is a healer after all. ",-1,"TRUE"
"1097","Don't forget that she needs to deal damage with her right-click to continue healing. Nerfing the distance would make it very difficult to gain resources to heal without sticking your neck out really dangerously.",0.2,"FALSE"
"1098","Basically how Symmetras gun should be like. I'd actually play Symm if they changed her aiming business to be more like Moira",1,"FALSE"
"1099","The loud ass audio is more annoying to me than the visual clutter",-1,"TRUE"
"1100","Honestly Moira v Moira and Doomfist v Doomfist are two of my favorite kinds of fights. It's like going full anime. ",1,"FALSE"
"1101","Doomfist for sure, especially between two more experienced Doomfist players trying to psyche each other out and outmaneuver one another.So fun.",1,"FALSE"
"1102","I like foomfist v doomfist the other guy is to busy trying to combo me while I smoke his ass with fingy cannons",0,"FALSE"
"1103","Maybe it's just me (it probably is just me lol), but in FFA Deathmatch on console (PS4), I have a hard time as Hanzo consistently killing her. Obvs I'm just bad, but even so, the tall, thin frame makes it harder for me to hit headshots and bodyshots somehow. All this occuring while she consistently drains me of my life with her attack and damage orb.",-0.5,"TRUE"
"1104","Since her beam is more forgiving I could certainly see people on consoles having a harder time actually killing her compared to PC. On the PC it's easier to actually track people usually so it's easier for people like Hanzo or Mcree to just hit her back at the same time and kill her faster than she can self heal.",0.428571428571429,"FALSE"
"1105","She becomes super frustrating to duel if she AD crouch spams. Her tracking doesn't suffer from it and doing it yourself against her is also useless.",-0.5,"TRUE"
"1106","Overwatch's Hitboxes are kinda atrocious. A lot of character models have parts that just aren't part of the hitboxes for whatever reason, like Mercy wings, and a lot of abilities have incredibly misleading effects, like Genji reflect actually being 3x it's size and Earthshatter just being a giant mess of won't go around a 1/8ths inch corner but will hit that lucio on the wall behind two pillars over there.Even beyond technical issues, a lot of characters just have tiny hitboxes which are super unsatisfying to try and hit. These tiny peeps also often have incredible mobility and deal a ton of damage. They also aren't distinct enough from eachother, good luck telling if it's a Symmetra, Moira or Widowmaker in the dark or at a range. ",0.2,"FALSE"
"1107","They disabled Lucio in 1v1, my main, yet Orisa and Moira are in there?",-1,"TRUE"
"1108","Orisa fights are just waiting for one of the two to get bored enough to do something stupid.",-0.333333333333333,"TRUE"
"1109","Actually, you can go full aggro and throw your shield ""inside"" her shield, because of the format you'll have protection while she doesn't, she'll either have to back off or go all in too.",1,"FALSE"
"1110","D.Va is also one of those heroes where I'm not sure why she's disabled.",-1,"TRUE"
"1111","They disabled her in 1v1? She used to be available, why would they take her out? Because it took a long time is about the only thing I can think of but even then it wasn't nearly as long as Orisa can be.",0,"FALSE"
"1112","whoever gets knocked out of mech first loses",-1,"TRUE"
"1113","Granted two really good Lucio's have 0% change to kill each other. I found another Lucio main with 200+ hrs like me and we went 1v1 in an FFA in a room by ourselves and it went on for about 2 minutes until both of us agreed it was a waste of time.",0,"FALSE"
"1114","No Tracer coming in for the last hit or Junkrat concussion mine to kill you both? FAKE.",-1,"TRUE"
"1115","I love 1v1 Moira. Usually comes down to who plays the best mind games. Gold orb almost always, try to pull them away from there's. Dark orb if under half hp and their orb has over 50% cd.",0.5,"FALSE"
"1116","If she has already used her dash you can safely force her out of a fight with your damage orb or even kill her. Whoever can get a dash off to avoid the orb is going to win the fight or at least run her off rather than stand there sustaining each other for ages with the yellow orbs =p",0,"FALSE"
"1117","I love them too. I win almost every 1v1 fight as Moira. For Moira vs. Moira, I start out with the gold orb, throw my damage and stick my secondary attack to them, fade from their damage, and have my secondary attack stick as soon as I am done fading. If they heal out of my damage, I pull back and repeat. Sometimes, I try to bait out their orbs and lure them to another room or area where mine could have maximum effect. I also tend to find the ult not very useful without teammates.",-0.166666666666667,"TRUE"
"1118","That feel when you've never played the hero before so you just send the healing orb off towards the enemy for some reason. ",0,"FALSE"
"1119","In this case, the healing orb was sent toward the enemy so that it could spend a small amount of time healing Moira herself (it's 75 HPS vs the damage orb's 50 DPS, it's better to use it) without forcing her to turn away and stop damaging the other Moira",-0.5,"TRUE"
"1120","Maybe I'm backseating, but I feel like a flick to the left to bounce it off the wall back to herself and doubling the healing gained would have been a lot better. ",1,"FALSE"
"1121","Yeah, I said that elsewhere in the thread too. It would have been a better play.",1,"FALSE"
"1122","Stay at range and use strafing. Turns it back into an aim contest, still takes longer than it should, but it has more moments where one person is getting damage in and the other isn't. Other than that, use orbs as mentioned by others here.",-1,"TRUE"
"1123","https://youtu.be/vpFIj_8daVU?t=3m24s The likeness is striking",1,"FALSE"
"1124","If I see too many Moira's in DM I switch to Roadhog, try to hook her, if not successful I wait for the CD while using the heal to sustain myself until then.I have a good success rate with until a **** Mcree, Hanzo, Reapet, Junkrat come in thinking ""easy double kill"" and ends up giving the Moira the winning kills of the game. ",0.5,"FALSE"
"1125","OMG it's Vanilla WoW paladin duels all over again...",1,"FALSE"
