"","forum_text","sentiment_score","negative"
"1","Okay, nothing's impossible. Are we talking about- uh, is this a bird back in Russia?",-1,"TRUE"
"2","GOD I LOVE BEING AN OWL!",1,"FALSE"
"3","Just nevermore, don't like plague doctor. ",0,"FALSE"
"4","I'm so bummed I missed out on 80s Zarya :'(",-1,"TRUE"
"5","I got Mei's zombie skin so there's that.",-1,"TRUE"
"6","COMPLETELY AGREE. someone please make mercy a bird skin. Like a super cool pheniox please. ",1,"FALSE"
"7","The only heroes right now with bird skins are Pharah, Reaper, Bastion (I literally consider Ganymedes existence sufficient), Widow, Rein (gryphon), Ana, and Zennyboi.Hanzo's wolf, Roadhog's pig, Sym's dragon, and hell even Lucio's frog skins will do in leu of. Every hero needs an animal themed skin. yesI'mafurrysueme",0.2,"FALSE"
"8","Ex furry. Current bird enthusiast  (ex falconer) bird skins are my life. I fuckin love hanzos wolf skin. Mcree needs one.",1,"FALSE"
"9","You left the fandom? For real?Tell me your secret! These people are driving me mad with their drama! I miss college it's that bad some days.",-1,"TRUE"
"10","I kinda just focued on other things. Cosplay got in the way. I still really want to make a fursuit because im passionate about creating things. But i dont interact with other furrys really.",1,"FALSE"
"11","I never stopped being a hog main.. and this skin like his last one is fucking S+",0,"FALSE"
"12","Really? Zenyatta and Zarya are my main squeezes as well. ",1,"FALSE"
"13","But, it shall never die!",-1,"TRUE"
"14","Heroes never die, for a price!But puppies live forever for free!Wish game logic worked IRL. I miss my doggies.",0,"FALSE"
"15","In quick play, Lucio Speed boosted me to get to Control point on Nepal. I quickly used the puppy emote and every stopped to appreciate itThen after like 5 seconds of going ""AWWWWW,"" Hanzo killed me with a scatter, then all hell broke loose.I'd like to believe Orisa took them all to save the puppy. Your protection is her primary concern... ( ;n;)",0,"FALSE"
"16","You know there should be a game mode that allows friendly fire (except in Ana’s case, she should still be able to sleep teammates) that way if any Hanzos (because it’s always a god damn Hanzo) pulls the same bullshit the Hanzo in your game pulled, then everyone should be able to shoot that mother fucker dead. ",-0.5,"TRUE"
"17","I checked Ganymede in Arabic, and it is similiar to the word of ganimat, which means loot. Coincidence!? Certainly not messing up with translator on a language I have no idea about!",-1,"TRUE"
"18","And the body proportions. That jacket should be slimmer or something. And the pants already look they have a shitstain, then they hang low so it actually looks like he has a smelly load in em. Or a large ballsack lol",-0.333333333333333,"TRUE"
"19","Definitely body proportions. The waist is way too low. I'm fine with the beard.",1,"FALSE"
"20","i thought that was the main appeal of the skin",1,"FALSE"
"21","The skin is still dope, but I prefer the dark green colors with the cool ear ring. ",0,"FALSE"
"22","Haven’t logged in but apparently yes. Yes, we can get it as an emote.Unless someone has played a terrible, terrible joke on us.",-1,"TRUE"
"23","Because puppy is already too much awesomeness for 1 character for 1 event so they need to save reindeer for next year.",1,"FALSE"
"24","Yeah, that leak was BS. It seemed like a low-effort epic and I believed it.I mean, I totally love every other skin we got this year, but that was rather sad.",-0.2,"TRUE"
"25","I miss 750 credits epic skins. Instead we get a bunch of legendaries that cost 3,000 each, and I can only afford one for every two events.",0,"FALSE"
"26","There was a leak with that? I just thought of it when I checked the hero gallery after the update went out. Guess that'd be a pretty easy epic to photoshop though.",0.5,"FALSE"
"27","THAT ORISA EMOTE THO. Who cares about the legendary skins, Orisa having a puppy is all I care about.",1,"FALSE"
"28","That Sombra skin looks so cool!",1,"FALSE"
"29","Yeah WTH most of the epics are great",1,"FALSE"
"30","Looks like another infamous female outlaw who is known for stealth from a blizzard gameVanessa Vancleef",-0.333333333333333,"TRUE"
"31","Icy Vanessa is exactly what we need!But if they could I would love vancleef skins. I'd love vanessa sombra or widow and a mccree edwin",1,"FALSE"
"32","Personally I love it since I didn't like Sombra's theme at all. That's the great thing about event skins, that even for those of us who don't like the basic design we can love redesigns. ",1,"FALSE"
"33","Same. This is the only Sombra skin I really like.",1,"FALSE"
"34","Fuck man, now i have to play overwatch again. It's a rule for me. I need to have every item for sombra",-1,"TRUE"
"35","It should be great that she had na diferente ultimate voice line like ""Congelando las luces""",1,"FALSE"
"36","I honestly don't like it. I don't like these fantasy-like skins for OW. I prefer the modern ones much more.",1,"FALSE"
"37","It also looks nothing like her. It doesn't keep a single aspect of her style.",1,"FALSE"
"38","You mean the style that has changed with every legendary? It's a theme that Sombra likes playing with her hair. ",1,"FALSE"
"39","I finally understand why I love this screenshot so much",1,"FALSE"
"40","I wish Tracer got a skin based on Bayonetta honestly, with (non functioning ofc) pistols on her heels and shit. ",-1,"TRUE"
"41","How the fuck are we not talking about this Ana skin. Easily top 3 for me!",0,"FALSE"
"42","More like how are we not talking about Mei throwing down Junkrat's trap?",0,"FALSE"
"43","Oh, I didn't see that video.  Understandable. ",1,"FALSE"
"44","Would be better with a visible face",1,"FALSE"
"45","I highly disagree. The Owl mask is amazing!",0,"FALSE"
"46","For me the mask is the best part maybe an option to unmask?",1,"FALSE"
"47","And here I thought with 7k currency grinded I had enough for my favorites.. RIP my free time.Ameizing",0.333333333333333,"FALSE"
"48","Oh look, fuck all for Pharah once again.",-1,"TRUE"
"49","Pharah has Anubis skins, so a Dog-themed skin for Chinese New Year that ults fireworks would be good.",1,"FALSE"
"50","ice queen pharah already exists and is fucking awesome tho ",0,"FALSE"
"51","so many cool skins - I love how Junkrat is such a joke lol",0.333333333333333,"FALSE"
"52","Nah, December is summer in Australia. It's actually geographically correct, LOL.",1,"FALSE"
"53","Would be nice if this became a running gag for Winter Wonderland, every character that lives in the south hemisphere actually wearing summer clothes for christmas. In Brazil is so hot on december that we have many songs about how Santa has to change clothes to come here and instead of warm milk would be better to let the ar condicion/ electric fan on. Or christmas is usually at the beach, or people spend at home and the go to beach's for the new year's eve. ",1,"FALSE"
"54","...OMG now I have a mighty need for summer Christmas Lucio. :o I have no idea what that would entail, but that sounds fantastic.",1,"FALSE"
"55","Something like surfer wear, but his trunks are Christmas-themed and his necklace is Christmas lights?",1,"FALSE"
"56","It's almost a shame he's not Hawaiian.  Luau Santa could work with him.",0,"FALSE"
"57","Except that his buddy roadhog gets consistently wintery and festive skins. Geographically correct but thematically inconsistent...literally unplayable",0.5,"FALSE"
"58","And still no mittens for junk. FeelsColdMan :(",-1,"TRUE"
"59","It's a real shame for anyone who mains junkrat...the joke wears off after .01 seconds and all we are left with is a trash skin that costs 3000 gold",-0.5,"TRUE"
"60","Maybe Roadie just really likes snow, IDK.",1,"FALSE"
"61","Doesn't that mean that Lucio should have a summer skin as well? I thought Brazil was in the southern hemisphere.",1,"FALSE"
"62","That hanzo skin would be awesome if it wasn't for the disconnected grey beard, ruins the whole skin",0,"FALSE"
"63","Can we get a recolor for Hanzo? Not digging the grey beard/black hair look especially with it disconnected all the way through (i can look pass that though), but yeah just all grey or black hair Hanzo, would buy loot boxes for that. Love the Ana/Sombra skin tho!",0,"FALSE"
"64","""Genji, Genji, what a prick.""",-1,"TRUE"
"65","Beat me to it, fucking amazing skins man. ",0,"FALSE"
"66","Junkrat looks like Casey Neistat",1,"FALSE"
"67","i'm waiting for comments like this.",1,"FALSE"
"68","The maps look amazing with the winter makeover.  That Ana skin and Orisa emote are at the top of my wish list. ",1,"FALSE"
"69","Mei and Winston were pretty friendly considering that he was about to murder her if it wasn't for the bear trap she had with her.",0,"FALSE"
"70","What was that junk rat thing at the end?",-1,"TRUE"
"71","Man, feels bad when your first arcade lootbox has a legendary, but it's a non-event legendary. An ugly one at that (IMO).",0,"FALSE"
"72","I promised not to spend any more money on lootboxes after dropping about $300 Aud since release. Now I must break that promise.Sombra skin and lil puppy come at me. ",0,"FALSE"
"73","I just have one question, does Mercy get some Christmas love?",1,"FALSE"
"74","She gets a very cute new victory pose!",1,"FALSE"
"75","Mercy got enought love for a lifetime",1,"FALSE"
"76","Any tips for Meis snowball gametype? Im diamond but havent gotten a kill in the 2 games i played of it.  The Yeti one seems just weird to me as well. I dont understand what im doing with her Ult in either gametype.",-0.333333333333333,"TRUE"
"77","im not too good with the snowball one but the yeti one is pretty easy. All you really have to do is bunch of with your mei pals, ice wall the yeti in some corridor and have cycle freezing/ icicle shooting. ",0.5,"FALSE"
"78","The ult is a bear trap. Put it on the meat.",-1,"TRUE"
"79","I thought it was funny",-1,"TRUE"
"80","Sigh... my computer just broke. Dont know how long it will take to fix it. :(",-1,"TRUE"
"81","The skins are amazing, they are so far the best ones. That Sombra skin is amazing! Better than last years at lease!",1,"FALSE"
"82","i like the direction in the video and how it flows",1,"FALSE"
"83","Takeaways:-Mei's new event looks pretty interesting. I'll have to see how it plays in game. The trap appears to just be Junkrat's trap, but it'll be interesting to see how people use this in terms of her strategy for this mode and how this could potentially effect her kit in the future.-A lot of the skins look pretty cool. I'm a fan of Bastion, Hanzo, and Sombra's new skins. Roadhog and Ana also look pretty cool, but honestly, that's about it for me. I still have some other skins I missed out on from last year (such as Santa Torb), so I'll probably only get one of the above. But honestly, I'm fine with whatever.-No matter what happens I will get that puppy emote and protect that dog with my life and beyond.",0.5,"FALSE"
"84","RIP this even't because of my defect PC :(",-1,"TRUE"
"85","Wishing you a better one for Christmas :)",1,"FALSE"
"86","Does it bother anyone that the dog disappears if Orisa gets killed? Summon a puppy on a payload...should I stop it?",-1,"TRUE"
"87","The Hanzo skin would've been good if he didn't have grey hair :( Idk it just bothers me because he's only 38 and it's too much grey hair. ",0,"FALSE"
"88","Most wonderful if you dont live somewhere it snows 4-5 months a year!",1,"FALSE"
"89","I don’t play hanzo, but I was so hyped about this skin. I was going to have it as my main skin and use the hell out of it. But it looks damn terrible. I’m not going to get it unless they patch this. I can’t decide what is worse, The white cotton balls glued to the side of his head, the weird bald strip, the saggy pants, or the out of place piercings.One user fixed these problems. So for the love of overwatch please fix this.",-0.75,"TRUE"
"90","Sombra should have a diferente ultimate voice line in her new skin,one example:""Congelando las luces"".Can you do this,please,I'd appreciate a lot",1,"FALSE"
"91","Am I the only one who's slightly disappointed by the event? Only 7 skins, all legendary. (they're all gorgeous, though)I wasn't a huge fan of the snowball fight last year, and the Yeti hunt is kinda ""meh"" to me.I guess this is what we get when we complain about all the variety and quantity in previous events...",0.2,"FALSE"
"92","Only 7 legendary skins...Really dude? That's a lot of quality skins. Even though they are harder to get, I prefer top notch ones than recolours. ",1,"FALSE"
"93","I never said they weren't top notch. I simply said I was disappointed with the offering this season. None of these skins are really of interest to me, and none are for heroes I play. Also, the game modes are pretty meh, in my opinion.Maybe I'm wrong, and everyone will be singing it's praises until the new year event, but it disappointed me. ",-0.2,"TRUE"
"94","Wait, cryo-freeze is supposed to clear the grenade debuff? I always thought that was intentional.",0,"FALSE"
"95","Yeah, that seems like a big change. A good Ana getting that grenade on a Mei before she freezes was huge.",0.333333333333333,"FALSE"
"96","Seems like a Mei buff disguised as a bug fix",0,"FALSE"
"97","Was listed as a bug over a year ago. They just finally got around to it. But definitely a nice buff for Mei",0,"FALSE"
"98","Which they shouldn't because most people are terrible as Ana.  Not to say that she shouldn't get play but.... you're not that good at aiming, most of you. Edit: I guess I should clarify more...  A lot of people pick Ana because she was one of the main Meta healers and they think that she's going to be a big advantage if they just pick her without really being good at being a sniper.  Yea you can practice with her and that helps but don't just think you have a leg up just because you're playing as her.  And also pay attention to who is on your team because team comp REALLY matters for Ana. ",0.5,"FALSE"
"99","Can't get better if you don't practice my dude.",1,"FALSE"
"100","Thank you!",1,"FALSE"
"101","It's not that people don't have the skill to play ana, it's that mercy is an all around better hero. If your gold or lower I might agree with that statement, but I don't think Ana's shots are that hard to hit. Valk &gt; nano also it's basically an easy team fight win when used correctly. Nano is much easier to counter.",0.8,"FALSE"
"102","Thats one of the biggest problems with the support classes. You have the offence/backup healers, and the main ones. The main ones being mercy and ana. Ana has her grenade... And thats it. Nano boost is no longer good, unless you and a genji god like me justkiddingimtrash are the only ones left and you both have your ults up and melt the enemy team. With mercy, on the other hand, you have:Very high, easy to hit and target healing beamsDamage boosts, available at any time.very high mobilitycan fucking flyzen/supercharge ult at once and can also fucking fly gooder during her easy to obtain ult.",0.285714285714286,"FALSE"
"103","It makes sense, it is an invul ability like wraith form and that one clears the debuff as well. Just strange that it took so long to fix. ",0.5,"FALSE"
"104","Yeah but the whole point of the nade is to prevent healing. Seems like it should remove the debuff but also still prevent mei from getting health from her ice",1,"FALSE"
"105","As a Total Mayhem enthusiast, this just made Mei a lot stronger. Now, only Sombra can stop her stall tactics.",0.333333333333333,"FALSE"
"106","It's been listed on their ""known issues"" thread for ages at this point.",-1,"TRUE"
"107","Fixed a bug that caused Moira’s eyelashes to detach from her face during her Heroic highlight intro",0,"FALSE"
"108","Genetic experimentation has its drawbacks.",-1,"TRUE"
"109","""How Horrifying."" ",-1,"TRUE"
"110","Wow, they did not lie about more detailed patch notes did they.",0,"FALSE"
"111","It's excellent really. Having minor changes in the maps not shown in patch notes is really annoying, same with having a hero stealth buffed/nerfed.Hopefully they keep up with this trend.",0.333333333333333,"FALSE"
"112","The most important part about this is the ""Mark all as read"" option in the hero gallery",1,"FALSE"
"113","I always get surprised how many people don't care about the items they get. Maybe I'm being overzealous...",-1,"TRUE"
"114","tbh I care, I dont care enough to scroll through all the mfing sprays, find the new one I unlocked, and click on it so it stops marking as read, 26 times. Tbh I just click really fast on all 4 items so it marks as seen when I get them in a misery box.",0.333333333333333,"FALSE"
"115","Fixed an issue that allowed some heroes to hide on the Junkertown payload when using sit emotesThe game done changed.",-1,"TRUE"
"116","still waiting for upper cut to be fixed, thats my main issue",-1,"TRUE"
"117","I haven't had noticeable problems with uppercut, what's up with that?",-1,"TRUE"
"118","its very inconsistent, when you knock someone up sometimes they are higher than you, sometimes they are lower than you, when they should be eye level with you when you knock them up",-1,"TRUE"
"119","I'm sorry but every time you said ""knock someone/them up"" it made me laugh a little bit. I'll see myself out.",-1,"TRUE"
"120","I always make sure the people I knock up are eye level with me ;) ",-1,"TRUE"
"121","A quick suggestion to blizzard.Separate the non game play bugs from the game play bugs.Maria’s eyelashes and Doomfist punches have 2 totally different impacts",-1,"TRUE"
"122","I've run into a few people mispronoumcing her name as Maria. Unless they meant to like ganja/Genji.",1,"FALSE"
"123","I keep getting people who keep pronouncing it like the ""Mines of Moria"" instead of the Irish name ""Moira.""too much LOTR.",1,"FALSE"
"124","Yes listen to this guy Blizzard!I really appreciate the more detailed patch notes (I really do!), next step should be organizing them!",1,"FALSE"
"125","Players can now clear new item notifications with the “Mark All As Seen” button in the Hero GalleryYASS",1,"FALSE"
"126","Praise be to based doomfist gods",1,"FALSE"
"127","I think Roadhog Hook might have gotten less warp bugs as well.Time to hook the rocket punch man.",-1,"TRUE"
"128","don't get your hopes up as it stands some of their ""fixed"" bugs are still inconsistent as ever... like railings etc.",-0.333333333333333,"TRUE"
"129","My hero",1,"FALSE"
"130","Can Moira damage Torbjorn's turret now?",-1,"TRUE"
"131","This and will her damage biotic orb now target Symmetra turrets and Torborn Turrets. Read it should.",-1,"TRUE"
"132","So throwing a biotic orb destroys any Symmetra turrets immediately? I thought that  was intentional since it seems too easy unlike destroying a torb turret",1,"FALSE"
"133","How about Zarya's bubble ? Why it won't release any damage to bubbled enemy ?",-1,"TRUE"
"134","Barriers block the orbs ""lock on"". If it blocks the lock on, no damage is given out as it ""CANT"" initiate.",-1,"TRUE"
"135","Absolutely not ! barrier won't block lock on as symmetra, winston, and turrets still able to do damage to it. don't spread misinformation here.",-1,"TRUE"
"136","But Sombra can't hack through Zaryas barrier. So some lock on effects are cancelled.",-1,"TRUE"
"137","Indeed, but all barriers block the orb doing damage via it's lock on, that is fact. Just as Reindhart blocks Sombra hack.",-1,"TRUE"
"138","The new Orisa emote is freaking adorable.",0,"FALSE"
"139","""Fixed a bug that caused Moira’s eyelashes to detach from her face during her Heroic highlight intro""HAHAHA WHAT",0,"FALSE"
"140","HAHAHA WHAT Thank God FinallyFTFY",1,"FALSE"
"141","Torb's scrap meter is back to orange too now",-1,"TRUE"
"142","Really?? That's good to hear!",1,"FALSE"
"143","Players who report someone for poor behavior, resulting in a disciplinary action, will now be notified with an in-game message when the issue has been resolved. About time. Ranked competitive has been a toxic mess since season 1. Hope this change will be for the better.",-0.333333333333333,"TRUE"
"144","I'm almost more excited that the players who are getting reported will be notified of each report (if I read that right).",1,"FALSE"
"145","You get a warning when you're close to being banned ",-1,"TRUE"
"146","Launched the game a received the notification about my report being effective right away. Dunno if it's a placebo, but it felt really good knowing that Hanzo cunt (he was level 900, had 5 minutes on Hanzo among ALL game modes, he played Symmetra at start of the round and when Tracer destroyed his TP right away, he switched and proceded to suicide by feeding enemy team) I've reported today got at least a notification about his behavior. ",0.142857142857143,"FALSE"
"147","Yea, I haven’t played comp since season 1 primarily due to trolling and other toxic player interactions. This patch also added more feedback:Players being reported will receive an in-game message letting them know that they have been reported, along with a warning concerning continued negative behavior. Ongoing misconduct will result in silence, suspension, or a permanent ban, depending on the severity of the infraction (in severe cases, players may receive their punishment before receiving the initial in-game message).thank you devs for listening to us and increasing player feedback in the reporting systemI might have to come back to comp soon",-0.714285714285714,"TRUE"
"148","I hope though that they don’t receive a message immediately after each report. Like if someone being toxic I game receives a notification in game that someone reported them, are they likely to be worse? Do they start a witch hunt for the person in their game that reported them? I think a system where you get a notification to cool it after you’ve received so many would be better.",0.2,"FALSE"
"149","Just play and disable all Comms.On my smurf account for learning new heroes, I just disable voice and chat .No issues. ",-1,"TRUE"
"150","Players can now clear new item notifications with the “Mark All As Seen” button in the Hero Gallery Holy fucking shit it only took 1.5 years.",0.2,"FALSE"
"151","Does Moira's golden weapon make her nails gold now?",1,"FALSE"
"152","Fixed an issue that prevented highlights captured by Zenyatta players from recording correctly when the Cultist skin was equipped.S P O O K Y",0,"FALSE"
"153","The accuracy stat has been changed as well, it no longer gives you more accuracy % when you shoot on shields (at least at Reinhardt's shield as McCree)",1,"FALSE"
"154","Hopefully it doesn't lower accuracy percentage. Don't want to discourage people from breaking shields.",-1,"TRUE"
"155","This feels like such a mistake. Hope they change it. ",0,"FALSE"
"156","SR losses because of 'personal performance/ accuracy"" incoming. ",-1,"TRUE"
"157","This is listed as a bug on the forums https://us.battle.net/forums/en/overwatch/topic/20760285893",-1,"TRUE"
"158","I'm pretty sure orbs go through walls. I've shot damage orbs at walls and subsequently heard them doing damage on the other side.",-0.333333333333333,"TRUE"
"159","I think people discussed it on here before and reasoned that it was intentional",1,"FALSE"
"160","It seems odd. Mei walls count as climbable walls for Hanzo/Genji so why would they be treated as anything but a wall for everything else?  ",-1,"TRUE"
"161","Not really. Mei's wall records block damage, and its solid. It should be able to take an Orb.  Right now the only other orb counter is Dva matrix so this is fair ",0.5,"FALSE"
"162","Except Moira’s ball isn’t like Symmetras. It’s an entity that bounces off terrain. ",1,"FALSE"
"163","It's also weird that it won't release any damage to Zarya's bubble.",-1,"TRUE"
"164","That’s fair but it shouldn’t happen with FRIENDLY Mei walls.",1,"FALSE"
"165","And Genji reflect. And walking in the opposite direction the slow ball is moving.",-1,"TRUE"
"166","I was more excited about these than the event to be honest lol. Doomfist main btw",1,"FALSE"
"167","Player Warning UpdatesSeveral changes have been made to the player report system.Players being reported will receive an in-game message letting them know that they have been reported, along with a warning concerning continued negative behavior. Ongoing misconduct will result in silence, suspension, or a permanent ban, depending on the severity of the infraction (in severe cases, players may receive their punishment before receiving the initial in-game message).Players who report someone for poor behavior, resulting in a disciplinary action, will now be notified with an in-game message when the issue has been resolved. We take every report seriously, along with your feedback. Thank you for your patience as we continue to fine tune these systems.We needed some changes in the report system, but this one will be a tough pill to swallow. Lots of people throwing after seeing the message. Not to say anything about the instantaneous satisfaction for those reporting people who are streaming and being able to see in real time the effects of their actions. It would be nice to have some punishment for those who are reporting as a sport.",-0.230769230769231,"TRUE"
"168","Would be great if the notification came after a game. Like how the deranking message does.",1,"FALSE"
"169","I wouldn’t want them to be notified immediately, though, because they could look for and harass the people in the game who may have reported them. I hope they get notified either after receiving a number of reports or sometime later and not right after a game. ",0,"FALSE"
"170","Exactly. This will lead to (even more) people throwing games or tilting the rest of the team.",1,"FALSE"
"171","That would be better, yes. We'll just have to wait for people to start sharing their impending punishments before we know how the system is implemented.",0,"FALSE"
