"","forum_text","sentiment_score","negative"
"727","They also need to fix the in-game menu. It feels like really slow. Not sure how it is on other platforms, but it doesn't feel right. ",0.333333333333333,"FALSE"
"728","Lol this is how I used to play on my old laptop. I was forced to play mercy because I could just aim at names. I wasnt too bad tbf. ",0,"FALSE"
"729","When this happens to me I will pick junkrat and do pretty well for the 3 minutes it takes to load in. I just stand back and fire at the objective lol",1,"FALSE"
"730","Ahahah yea, I main justrat now and I'm pretty sure I could get kills just spamming choke point n' what not.",-0.333333333333333,"TRUE"
"731","This isn't just XBOX.  This happens on PCs, PlayStation etc.Its not an XBOX issue, its a hard drive issue.  Look into replacing your XBOX's hard drive.",-1,"TRUE"
"732","I get what you're getting at, but it is not terribly helpful to the community playing on X Box hardware. The whole idea of buying a console is to have a canned gaming experience without having to think about the hardware details. The canned X Box drive is painfully slow. Blizzard needs to code around that if they are staying within the restrictions of that environment, or they need to make it explicit that their game requires non-standard hardware/Xbox 1 X. ",-0.5,"TRUE"
"733","I keep seeing these and am not sure if it’s hardware or not, i used to get it a bunch when I played with my laptop, usually for 20 seconds (running integrated graphics) then my first GPU (gtx 960) still had this problem, only for about 5-10 seconds, and not as frequent, now my current GPU (gtx 1070) doesn’t have this problem, unless I join a game in progress really late, and even then it’s no longer than 3 seconds",0,"FALSE"
"734","Yes but its not limited to console is my point, so it’s leading me to believe its a hardware issue",-0.333333333333333,"TRUE"
"735","As PC, Xbox, and PS4 Overwatch are all essentially different games I'm going to use the argument of ""you can't blame the hardware you designed specifically for when it doesn't work"".",0,"FALSE"
"736","Iit is berry infuriating",-1,"TRUE"
"737","Tip for this is to play Zenyatta until it loads, if you can. The markers for the orbs will at least give you a vague idea of where team-mates and enemies are. I had this issue with a previous hard-drive that was dying.",-1,"TRUE"
"738","I used to play matches where the first 5 minutes were like this until I got my Xbox one X. Haven’t had the problem since. ",0,"FALSE"
"739","I had this issue on my original Xbox One. I picked up the Xbox One X on release and this issue disappeared entirely. I know not everyone can go out and get the latest console but at least we know it's a hardware issue.",-1,"TRUE"
"740","I can understand this happening on pc since there’s so many different PCs that might be lacking in some department. Mine does this sometimes and I assume something wasn’t running right. But how does it happen on console? I would think all ps4 and all xboxes are the same, and a game made for a console should be able to be played on a console it’s designed for.",0,"FALSE"
"741","It's getting worse every patch. Sometimes I'm able to move before the map even loads. I switched to Moira on Oasis, hit LB to fade and by the time the screen loaded I was already out of spawn (albeit Moira still wasn't visible)",0,"FALSE"
"742","I get that on PC every now and then and it sucks",-1,"TRUE"
"743","While the severity is the largest on console, or Xbox One, it's not console specific. This also happens to my game on my laptop, it takes a second or 30 to load in the textures on the first game of the session, or sometimes randomly when joining a match.",-1,"TRUE"
"744","How does this realistically get through playtesting on blizzard's part? I don't play console but this seems like a glaring issue.",0,"FALSE"
"745","its propably the 5400 rpm hdd that console use because my laptop has one it and it cause me the same problems",-1,"TRUE"
"746","This is a hard drive issue. Xbox purposely slows down the speed of the Xbox when using the default hard drive. I'd reccomend getting a 1TB hard drive. All loading issues disappeared. ",-1,"TRUE"
"747","Why are you doing this ?, this fixes itself in 10sec but you cut the video so people think it happens for a much longer time. the problem isnt the game, the consoles are too slow.",-1,"TRUE"
"748","Well yeah the problem isn't the game but this wasn't happening to me a month ago and it went from a few seconds to actually having you sit in spawn to wait for your character to load, it's impacting gameplay a lot specially in deathmatch and comp games that last longer so you spend less time in spawn after a round ",0,"FALSE"
"749","Blizzard said this is an actual issue they're looking into though",-1,"TRUE"
"750","Well I don’t know then. I am a PC player and I had bad internet at one point and this was a cause of it. I got a new router and everything was fixed.",0,"FALSE"
"751","The models aren't downloaded over the internet. It's the rate (and the order) that the data is loaded off the hard drive.",-1,"TRUE"
"752","So hilarious",1,"FALSE"
"753","Or with Hanzos arrows, like in Warframe. ",1,"FALSE"
"754","Oi! You turned Moira into modern art!",1,"FALSE"
"755","Savage!",-1,"TRUE"
"756","Considering coffee is poisonous to birds, this is just tragedy waiting to happen",-1,"TRUE"
"757","Still poisonous, they both have caffeine.",-1,"TRUE"
"758","It's hot cocoa (holiday themed). How about now?",1,"FALSE"
"759","Useless fact of the day: There's actually caffeine in hot cocoa too. ",0,"FALSE"
"760","Another useless fact: Theobromine, the compound that makes chocolate so, is almost molecularly identical to caffeine. It is classified as a stimulant, but is absorbed by the body much less efficiently. Interestingly enough, there are some teas that contain theobromine.",0.333333333333333,"FALSE"
"761","So y’all mothasuckas just determined to kill this damn bird huh?",-1,"TRUE"
"762","And isn't chocolate poisonous to birds as well? I know that cats and dogs cant eat it so it would make sense that birds can't either. ",0,"FALSE"
"763","Why, because birds are so similar to cats and dogs?^(I actually have no idea I’m just being facetious)",-1,"TRUE"
"764","I was thinking weak stomach, but now that you say it yes very similar indeed. Have you never heard a bird bark or meow? They are the same I tell ya.",-1,"TRUE"
"765","But have you not heard a bird sing? And who else sings? Thats right, humans. Therefor birds are humans",1,"FALSE"
"766","Yes, chocolate is poisonous to birds.",-1,"TRUE"
"767","Who’s to say it isn’t just water in there? Not like Bastion is going to drink it. ",1,"FALSE"
"768","Still poisonous. Water is poisonous to birds too. ",-1,"TRUE"
"769","Poor ducks!!!",-1,"TRUE"
"770","I don't think Bastion would drink coffee or tea either, notice how there is no steam coming out, so no hot beverage. I see him as a humble robot that tries to please everyone, so he just filled it with water to keep Ganymede hydrated.",1,"FALSE"
"771","I'm guessing this will be the official reasoning for Ganymede drinking it. It's just a cup of nice cool water for him since Bastion doesn't need the drink.",1,"FALSE"
"772","its minecraft all over again (Feeding Parrots cookies used to heal them even though chocolate is poisonous to them)",0,"FALSE"
"773","All you guys think a robot drinks tea and coffee. That's pure motor oil in there. ",1,"FALSE"
"774","Motor oil isn't good for electronic systems. It's more likely to be coolant.",1,"FALSE"
"775","Now I know the fact that Bastion having the same type of cup as Ana is likely due to re-using assets. But I'd LIKE to believe that she gave him one for the holidays instead. :-)",1,"FALSE"
"776","That means Ana, still pretending to be a dead woman, visited Torbjorn and saw that he made a robot friend and gifted robot friend a teacup. Which also means she just randomly carries around teacups to give people who think she’s dead. I love it. ",-0.2,"TRUE"
"777","Ana knows bastion doesn’t need a teacup but she knows a death robot with a bird friend would probably appreciate a teacup ",0,"FALSE"
"778","This makes my Secret Santa mark a lot easier to shop for.",1,"FALSE"
"779","You are thinking with human. You should think with portal omnics instead.Ana gifted a bird holding complex/mobile bird living quarters to Bastion.",0,"FALSE"
"780","Easy, she just dressed up as Santa to not blow her cover. ",0,"FALSE"
"781","""robot, do you know cuphead?"" ana asked as she placed her teacup on bastions head. she later would forget the teacup still resting on the bastions head. a new friend was made, and ganymede liked it",1,"FALSE"
"782","im frustrated at their lack of effort :/ still waiting for that teacup icon too",-1,"TRUE"
"783","Oh that’s very cool of them. How does the Sombra’s pose look?",1,"FALSE"
"784","Better check for Sombra clues!",1,"FALSE"
"785","she stole it",-1,"TRUE"
"786","Lol she pourin' out one for the homies? Maybe her nog is super dense?",0,"FALSE"
"787","Thank you",1,"FALSE"
"788","Thats less ""toast"" and more like ""limply holding mug""",1,"FALSE"
"789","Sombra could have had a hologram cup and as someone else mentioned bastion holds oil, it would be awesome if they could ninja this in before they release it just because it seems a tad under blizzards quality standard reusing assets like this, even if these poses weren't originally meant to be put in the game.",1,"FALSE"
"790","Holy shit the Overwatch team knows how to treat its community well.",0.333333333333333,"FALSE"
"791","I love how everyone loved Ana’s teacup, so now everyone gets a teacup!",1,"FALSE"
"792","I like the idea that Ana and Bastion are now friends because of Ganymede, and she let Bastion borrow her cup. ",1,"FALSE"
"793","Came here to say this.Was very disappointed.",-1,"TRUE"
"794","Aw man no motor oil? Missed opportunity",-1,"TRUE"
"795","I'd be up for oil but I think it might be harmful for birds...",-1,"TRUE"
"796","So that's why they didn't use Bastion pose... they were probably unhappy with Ganymede's animation, or it was too buggy. Maybe they didn't want to use the same asset (Roadhog's toast cup has same shape but different pattern). Sombra's cup probably didn't look ""Sombra"" enough, in fact it's also a reused asset from Soldier's victory pose.",0,"FALSE"
"797","Yeah, if you take a closer look at Ganymede's tail it looks like it's been cut in half (probably because of clipping issues), it looks a little weird though.If they didn't show this victory pose in advertisements I don't think this pose would of ever made it into the game. (I'm glad it did because I really like it)",0.333333333333333,"FALSE"
"798","I like it a lot too, I'm just surprised that both the poses and the Hanzo skin were first put to PTR instead of straight to the game. Maybe they want to further tweak them when they get the time?",1,"FALSE"
"799","console issues, friend;extended patching process--also, holidays",-1,"TRUE"
"800","In animation the main concept is having separate ""snapshots"" called keyframes that remembers where each bone is, and the program displaying the animation moves the bones inbetween each keyframe smoothly.It can do this in a variety of speeds. A bezier curve that is slow at the start then moves towards the next keyframe faster as it gets closer produces an effect that is very satisfying for say, a blacksmith striking his metal or other organic movements.Bastion in this case is a jittery robot, it is very likely that they used linear(constant speed) speeds inbetween each keyframe to fit the animation style better.The bird being in the same animation, (in theory) is being affected by this linear timing, making it seem like horrible animation when its actually just a limitation of the animation.the more you knowtm",0.111111111111111,"FALSE"
"801","While you're right about a lot of things, correct me if I'm wrong but current industry standard isn't to animate directly to the model, but animate on a rig and then bake every frame of that animation back to the skeleton. In a behind the scenes kinda video I remember seeing the animator for Mei  using Maya, and in Maya there's nothing restricting you from using linear curves on bastion and bezier curves on Genymedesp?. In fact, you don't even need a single control to be entirely linear or bezier or any other type of curve. A lot of bastions parts are clearly done using actual curves I  fact.",0.5,"FALSE"
"802","You're absolutely right, Maya has plenty of tools that allow for mixed curves and even custom curve plotting, and yes it is baked into a file that Overwatch and its engine uses.But ultimately it comes down to whether Overwatch engine supports mixed curves, Maya will always have an incredible amount of more options than any game engine could handle.",1,"FALSE"
"803","Let's just hope that Bastion and Sombra's cup/mug design will change since their Toast victory poses are meant to be released next year so maybe they aren't final versions yet.",1,"FALSE"
"804","Thats adorable. Bastion doesnt need to drink so he holds up a birdbath",1,"FALSE"
"805","Let me smash (smashtion returns) ",-1,"TRUE"
"806","Anyone else feel like the character that can melt through an entire team in seconds shouldn't be so cute?",1,"FALSE"
"807","aww I'm disappointed.  From the title I thought he was going to turn into a toaster and make some toast.",-1,"TRUE"
"808","His enemies are toast. ",-1,"TRUE"
"809","OH MY GOD OH MY GOD OH MY GOD ITS SO CUTE",1,"FALSE"
"810","As is every bastion cosmetic. He's one cute fucking robot.",0,"FALSE"
"811","Bastion itself is too cute",1,"FALSE"
"812","More like ""tea pose""",1,"FALSE"
"813","Can we talk about Mercy's? It worries me a bit.",-1,"TRUE"
"814","Ganamyde! NO!!! He ruined the tea with his feathers!Tea is literally, undrinkable!:p",-1,"TRUE"
"815","Too bad they didn't mimic the Dark Souls toast emote.  Would have have been a nice little Easter egg.",-0.333333333333333,"TRUE"
"816","I love how they incorporate animals into the emotes and victory poses. Orisa with her dog puppy, Bastion with his bird... I wonder what's next?",1,"FALSE"
"817","ALL HAIL LORD GANNYMEDE",1,"FALSE"
"818","Is it bad that I judge bastion skins based on how Ganymede looks",-1,"TRUE"
"819","Blizzard is fighting toxicity towards the game with cuteness, first Orisa's puppy emote and now this ",1,"FALSE"
"820","Is Bastion powered by a combustion engine? Like, I get they didn't want to make him just stand there in a static position for aesthetics, but that bouncing is....unnerving. ",-0.333333333333333,"TRUE"
"821","most people in the western world subconsciously associate the rhythmic chugging with old tech like combustion engines, which gives bastion the feeling of being an ""old machine"", which he is - at least in-universe.",1,"FALSE"
"822","Looks great",1,"FALSE"
"823","Damn, never realized how nice the fake ""bokeh"" looks on these preview screens.. I need to stop playing at 50% render scaling...",-0.333333333333333,"TRUE"
"824","While you're all here to look at this cute bastion pose, let's all remember bastions tank form ghost shot bug and hope blizzard fixes that too.",-0.333333333333333,"TRUE"
"825","Clearly it’s for his little birdie buddy. ",1,"FALSE"
"826","It's largely allowed because not allowing it is extremely hard and it's not an urgent issue for the vast majority of the users. Hard to justify the amount of work needed to stop players from having alt accounts in the top 500 for how little impact it would have.",-0.333333333333333,"TRUE"
"827","this. You want the team working on more skins, new maps, new heroes or some complex way of stopping someone from having 3 alts in top 500? There's no way to stop this even if you use mac/ip addresses because of the fact that LANs/gaming houses exist where multiple people share PCs. Only way to stop this is to have (pro) players voluntarily share their alts and for blizzard to then connect the accounts to one user (behind the scenes) so that only one of the accounts can be listed on the leaderboard. ",0,"FALSE"
"828","couldn't u connect competitive accounts to phone numbers? dota does this and while its not 100% effective at eliminating smurfs it has drastically reduced the number of smurfs/alts u encounter in game",0.333333333333333,"FALSE"
"829","You want the team working on more skins, new maps, new heroes or some complex way of stopping someone from having 3 alts in top 500? I just have to throw this in here because I see this myth repeated way too often: skins and maps are designed by entirely different personnel than those who handle more technical aspects and policies. Doing one does not usually slow the other down.Truth is that it's just not possible to neatly clean up the top 500 list as long as smurfing is allowed. And they can't do much about smurfs (IP/MAC is not reliable data for identifying them), and even if they could, they shouldn't as long as they get to the mmr where they belong quickly. At this point I'm pretty sure they make a ton of cash with people who repurchase the game several times just to play against newbies for 15 levels, and from a business perspective it probably wouldn't be wise to forbid it (again, as long as they get to their mmr quickly).",0.272727272727273,"FALSE"
"830","It’s not a myth. Have you worked in software development/IT Infrastructure projects, big engineering projects? You have a limited amount of resources be them money, people, time. Etc...even if the people working on something are different from the ones doing another thing, they all are part of the same project and in a way compete for the limit e resources allocated to the project. Blizzard might be big and OW a good money generator for them, but trust me, they have a budget to follow. People working means people getting paid, people getting paid means budget being used and the money bag being drained. So yes, 2 teams doing different things can slow down each other",-0.25,"TRUE"
"831","No, I'm sorry, you're entirely missing the point:ARTISTS AREN'T PROGRAMMERS.The ones they've hired to do art? They're doing art.The ones they've hired to program? They're programming.So tasks that affect programming won't impact the workflow of the artists, and vice-versa.So yes, it is a myth that ""If they work on preventing alts from getting into the top 500 we'll get less skins/maps.""The software development/IT infrastructure side of OverWatch doesn't have 3D modellers and level-design artists writing code, anymore than you'd have an electrician also doing framing and roofing generally. They're separate disciplines.",-0.2,"TRUE"
"832","I think the problem is you don’t understand how projects work. Companies big or small just don’t have unlimited resources. And games more commonly than not, work on them as projects, thus the “yes it affects the” I’m sticking with. Based on your reply I’m thinking you’re stilll in college or have not worked in projects before.Hell, even where I work at right now: I’m in IT. It’s a Fortune 500 company and we badly need an important software to be either badly upgraded or entirely replaced. It’s not happening and you know why? Big biiiig efforts are going into the upgrade in the Finance org which means budget for the rest is lower which means that software and the platforms it runs on Will not get touched this year, we got budget enough to keep it up and running. See how they are connected?",0.538461538461538,"FALSE"
"833","Honestly I really like this idea, but maybe only require it for top 500 because that's when people seem to care. I don't care if someone has 10 grand master accounts, doesn't bother me. But when someone has like 5 accounts in top 500 that's 4 people blocked out of their goal.",0.714285714285714,"FALSE"
"834","So how would you do that? lol Once you hit top 500 you have to provide your phone number or you'll be locked out of your account until you drop out of top 500??",1,"FALSE"
"835","You just wouldn't get the top 500 award or listing till you provide a phone number and verify through text. You wouldn't be locked out of your account, but you'd basically have no top 500 recognition. Maybe set your SR to a limbo state where your SR is locked at the lowest member of top 500 until you verify. Once you verify you get the top 500 title and get your SR bumped up to what it should be.",0.666666666666667,"FALSE"
"836","Nah, you just don't count for the 'top 500' leaderboard until you add the phone number.In essence you're hard-locked at ""position 501"" for the scoreboard without a phone number attached.",0,"FALSE"
"837","Smurf accounts ruin multilayer games. It's hilarious that these pros even make them. Seems a fitting way to make you look better than you actually are. ",0.5,"FALSE"
"838","It's not THAT hard to grab his MAC address. This would filter the list real fast.",0,"FALSE"
"839","Do you honestly think that we have a lot of TOP 500 accounts that are sharing computers?",1,"FALSE"
"840","I don't know, but in any case I wouldn't want to exclude 1 or 2 people from the top 500 just because they happen to be using the same computer as someone who is also in the top 500.",1,"FALSE"
"841","So instead we should exclude ~200 people because ~300 are in the top 500 more than once?",1,"FALSE"
"842","Why is ""this is not a good solution"" always turned into a ""this or nothing"" situation?",1,"FALSE"
"843","Yeah, I understand that. The two options we have are either: keep the system how it is and allow one person to take up multiple slots in top 500, or only allow one top 500 per MAC address. I dunno I feel like the chances of two people on one computer being top 500 is a lot lower than one person in top 500 having multiple accounts there",1,"FALSE"
"844","Consider the case where we had both in the top 500: One person with two accounts and two other people with separate accounts on the same PC. Would it be justifiable to remove the real person from the top 500 just so that we can remove the duplicate account from the guy that is there twice?",1,"FALSE"
"845","No, it wouldn't. It's not fair. But it's also not fair for the person who would be top 500 but isn't because someone has three or four accounts in top 500. ",1,"FALSE"
"846","You're right, I suppose we could have more of a verification process that goes along with making an account, such as having to put a phone number in or something. But there's flaws with that too. ",0,"FALSE"
"847","It's actually been proven to be only about 50 alt accounts in top 500.",1,"FALSE"
"848","Can you prove that there aren't?If there were a single case of it, how would you justify that one of them be banished from Top 500?",1,"FALSE"
"849","You get them to send an email to Blizzard to speak their peace. It would only be a few people tops. Also side note: I feel like this would prevent some boosting if it exists in top 500.",1,"FALSE"
"850","Disregarding the case of multiple people sharing a computer (which doesn't seem that outlandish), spoofing any level of hardware identification is trivially easy. And, should Blizzard come up with something that's too hard/annoying to spoof, you can always throw a VM at the problem.The reality is that client-side identification isn't viable these days. We need a per-user unique ID that exists outside of the game -- much like Korea has (I hear) and what the US could have if we didn't treat our SSNs like passwords.",0.333333333333333,"FALSE"
"851","You can change your MAC address if you want to. Fun trick if you're ever in an airport that gives you free WiFi ""for the first 30 minutes"".",0.333333333333333,"FALSE"
"852","What if people who had multiple top 500 accounts got a star or something next to their rank saying how many accounts they had in top 500, but only count the highest one.",1,"FALSE"
"853","I feel people should be able to de-legitimize their account to hold the Top 500 spot. Their SR will be the same and will be acknowledged as being equal to a Top 500 spot, but they won't actually be claiming a spot.This would just be a sort of ""honor system"" for people with alt accounts.",1,"FALSE"
"854","That would fuck with the numbers, what would it say on their alt account?",-1,"TRUE"
"855","It would show the alt accounts SR with the star counting the number of top 500 accounts they have all together. My guess you would be able to toggle this feature off and on as people would immediately point to it and lay blame.",0,"FALSE"
"856","That just gives a gold star for having more money and more time. It's not like keeping several accounts requires more skill.",1,"FALSE"
"857","Thats aimbotcalvin.All he does every single day is eat, sleep, eat, play Overwatch, and eat some more. If you want a spot in the top 10 then ''earn it retard''. And they're his words not mine.",0,"FALSE"
"858","If you want a shit ton of money then “earn it retard.”",-1,"TRUE"
"859","Why waste money on food when you could be using it on loot boxes?",-1,"TRUE"
"860","Those are his words? Color me genuinely surprised. I don't watch him but he always seems like a fun loving guy in all the clips I see of him. That's strange to call 99% of his fans/OW players in general retards",0.333333333333333,"FALSE"
"861","He doesn't say retard maliciously at all. Just seems worse when you read it over text as opposed to hearing him say it ",-1,"TRUE"
"862","Without the context, his statement seems rude. It was not said in a demeaning way at all, it's a lighthearted statement, that's all. But this is /r/Overwatch/ where things gets taken out of its proper context all day long, so... you know how that story goes...",-0.333333333333333,"TRUE"
"863","sounds like he earned it by putting in the time to get that good huh",1,"FALSE"
"864","How do you kill that which has no life?...",-1,"TRUE"
