"","forum_text","sentiment_score","negative"
"380","There's no rank restrictions for Open Division? Looking at it more I don't see a rank restriction for any division.",-1,"TRUE"
"381","From here: https://cdn-eslgaming.akamaized.net/misc/media/overwatch/opendivision/guides/player_path_en_nov_2017.pdfRequirements to play in the Overwatch Open DivisionPlayers who have reached 3500 in ranking (masters) or higher in the previous season of in-game ranked are eligible to play",1,"FALSE"
"382","Oh that graphic is really old. They tried to do rank restrictions in the first season, but it didn't work. They should remove that or change it.There are no rank restrictions as you can see on the posted link.Edit: Website updated",1,"FALSE"
"383","If they win it's gonna be the memeiest team championship",1,"FALSE"
"384","Or it'll be good proof to seemingly everybody on this sub and /r/Competitiveoverwatch that online rank means nothing. Something the FGC is already capable of knowing, for the most part.Rank, at a glance, is only good for potentially judging immediate game knowledge, but literally nothing else. ",1,"FALSE"
"385","Online rank means nothing...but I also saw Kelvin and the Chipmunks and various other streams during the first Open Division. Those poor plat six stackers. The only hope is if you are TLMO.",-1,"TRUE"
"386","Haha, yeah go win that. Rank mean something. But collectivity intelligence with bad personnal skills can also make win games. The level of play is way different at each level. Like every rank has really huge gap of levels.",0.6,"FALSE"
"387","Lmao it’s gonna be cute to see a bunch of plat nobodies getting their dreams crushed.  I’m a 4.1k player and even up here I can’t even touch a 4.5k player.  I don’t think you realize how much of a dramatic skill difference it is.  A 4.5k tracer is gonna solo kill your plat team.",0,"FALSE"
"388","That's just not true at all. There's plenty of videos or there to the effect of (3gms vs 6gold) and often times they even buff the GMs because it's too 1 sided in favor of the larger team. ",1,"FALSE"
"389","Well no shit, that's a 3 v 6...A 4500+ Tracer will kill the solo with a team supporting them for sure, we're still gonna have 6v6 teams.",0,"FALSE"
"390","They hated /u/venom_god Because he told them the truth",-1,"TRUE"
"391","I mean.. most teams right now are a pure joke. The amount of abandons and trolling I have seen. ",0.333333333333333,"FALSE"
"392","Does it have to be masters and stay in masters? What about a 400+ point fallen masters? lol",0.5,"FALSE"
"393","that means me and a bunch of my other gold friends can get smashed, great. ",1,"FALSE"
"394","Sweet! Now if only Blizzard gave a fuck about console players or developed for Linux. ",0,"FALSE"
"395","Linux development isn't worth their time by a long shot, don't even dream about it.Console players could always plug a controller into a computer if they really prefer the input method.",1,"FALSE"
"396","If I had a dollar for every time I heard that, we would have enough to fund a Linux port. As for plugging in a controller. The issue is I want to get away from the console and controller. Not use a controller on a computer. ",0,"FALSE"
"397","It's such a small part of the market, Blizzard uses a custom engine that would need serious work to port to an linux/OSX environment, and all of these people could just install Windows 7 on a partition if they wanna play video games and be done with the issue. See Steam Machines and how well that ended.Also if you dont wanna use a controller either then why even mention console?",0.333333333333333,"FALSE"
"398","Reread my original comment. You have completely missed the point. ",-1,"TRUE"
"399","Nah, I get the humour attempt but it kind of misses the mark. Granted games for linux is humor in itself.",0.333333333333333,"FALSE"
"400","Cool, cool. Hope a few Canadian Teams pop up sometime in the future. Would love one for my own city to be represented in the future (Calgary Cowboys? Calgary Cowboys). Wouldn't shock me if Vancouver ended up representing West Canada though :P (SureFour and a few other names aside, I have no idea how strong the competitive scene is in Canada).",0.666666666666667,"FALSE"
"401","I would really like Calgary to get away from the horse theme at some point ",1,"FALSE"
"402","I mean that would be refreshing, but being colder, gayer Texas is Alberta's whole shtick. At least cowboys and the wild west is a better theme than oil workers (it is law that I must talk shit about Edmonton).Or maybe we could go with a winter/whole other theme, who knows?",0,"FALSE"
"403","Vancouver is to small of a market unfortunately, prob only Toronto could hold one",-1,"TRUE"
"404","Hm, that's unfortunate to hear. I'm hoping we get at least three teams to represent Canada. One for West, one for East, and maybe a team in the middle that could also pull a few players up North (Toronto would definitely get East though, centre of the universe...).I was just assuming, you guys in BC have a lot of good sports teams, a thriving concert scene and a pretty nice chunk in the film/video game industry (last I remembered). I guess that wouldn't necessarily create a strong competitive scene for esports though. :P Here's hoping some talent begins growing there for the future then!",0.75,"FALSE"
"405","Biased as I'm from Toronto but there are only two Canadian cities that have a large enough population and that's Toronto and Vancouver.Toronto is generally seen as the preferable destination as its the hub of Canada. And aside from that, the population differential is massive, Toronto is unfortunately the only legitimate choice. I'd predict it to go just the way the Jays and Raps have, having a single Canadian team based in Toronto.",0,"FALSE"
"406","Yeah, that's fair. Still, I can hope we get at least more than one team.",1,"FALSE"
"407","Me and you both, I'd love 2 Canadian teams",1,"FALSE"
"408","a Canadian team would probably be mangachu, surefour, agilities and then people from other countries (worth noting idk the nationality of all NA players so I might've missed some)",0,"FALSE"
"409","Calgary cowboys ? I want to use profanity but I'll just say that's the silliest suggestion on the entire thread.  ",-1,"TRUE"
"410","I mean we did have a World Hockey Association team in the late 70's of the same name, so not completely out of left field.(Plus I love alliterative, cheesy and thematic team names, no matter how fucking silly it is, ahaha.)",-0.5,"TRUE"
"411","I keep getting an Error 400 when trying to connect Overwatch with Faceit. Anybody else?",-1,"TRUE"
"412","Neat to see that most of the Overwatch League teams are getting a ""minor league"" team. It'll be cool to see some up-and-coming stars in the Contenders League before they make their League debut.",1,"FALSE"
"413","masters player here, would love to try but it's honestly so hard to find a team, hard to find everyone in the same time zone, rank, etc. if anyone needs an NA dps/tank for their team let me know ;)",-0.2,"TRUE"
"414","yet the sign-up deadline seems like it was due last October, and there's a rank limit at 3500 sr. Haven't they updated the website?",0,"FALSE"
"415","That graphic is old. No idea why it's still linked on the site.Edit: Posted link makes it sound like sign ups are currently going on, but that’s just to register on the site. Sign ups for season 4 should begin in January.",1,"FALSE"
"416","/r/Overwatch and /r/Competitiveoverwatch both have LFG threads and discords.  The /r/Overwatch discord also has a text channel specifically for team recruitment.You could also use a specialty sub like /r/OverwatchLFT.",0,"FALSE"
"417","OW Open Discord has LFT channels herer/ow Discord has LFT channels herer/cow Discord has LFT channels here",-1,"TRUE"
"418","Will there ever be support for a console league or division?",1,"FALSE"
"419","Get ready Contenders Australia, the Grandmaster Silvers are going to the top!",1,"FALSE"
"420","With teams like Blank playing Pacific contenders instead Australia is actually super open in terms of who could win it. ",1,"FALSE"
"421","pretty sure you just need to be alive to make AU contenders",1,"FALSE"
"422","I want to try to gather up a team and play but I'm not that skilled and all I have is a laptop to game with.",1,"FALSE"
"423","I'm only a measly Gold player but this organized play sounds super fun to me. I need to try to convince my comp team to do this with me! Or find new friends.... =P",0.5,"FALSE"
"424","I believe Season 3 is going on currently so you will have to wait for Season 4 of Open Division sign ups which should be in January.Posted link makes it sound like sign ups are currently going on, but that’s just to register on the site. ESL still has a linked guide for the first season that they haven’t changed or taken down. There’s no rank restrictions. All you need is 5 other players that want to sign up together as a team.Edit: Should say all the players must be 13 years or older and have a battlenet account in good standing.Edit2: Website updated",1,"FALSE"
"425","Have to register with a team.OW Open Discord has LFT channels herer/ow Discord has LFT channels herer/cow Discord has LFT channels here",-1,"TRUE"
"426","If people are looking for a team to play this with I’m looking for 1 tank main pref Orissa or Rein, 1 DPS main pref hitscan , And 1-2 Support mains. Message me if you’re interested!",0,"FALSE"
"427","SR is completely irrelevant.",-1,"TRUE"
"428","Huh? SR is completely irrelevant because it's a tournament.",-1,"TRUE"
"429","I feel like I'm missing something. How exactly does the open division work?",1,"FALSE"
"430","Team registration closes after December 31st, 2017Team rosters lock after January 22nd, 20182 matches per week, 1 on Saturday, 1 on SundayWeek 1: January 6th – 7th, 2018Week 2: January 13th – 14th, 2018Week 3: January 20th – 21st, 2018Week 4: January 27th – 28th, 2018Week 5: February 3rd – 4th, 2018Week 6 (Playoffs): February 10th – 11th, 2018Idk how they determine the top teams for sure.",1,"FALSE"
"431","LF my fellow trash silvers to make those wannabe high rankers work for their wins!",0.333333333333333,"FALSE"
"432","Would love to take part in this but I don't know anyone or where to start. ",1,"FALSE"
"433","I’m trying to put together a team from the east coast (Mostly DC and New York), so far I have 3 spots taken, I have a Soldier main (myself) a D.va main and a Mercy main, and we need someone that plays a decent Lucio, Moira, or Ana in Support and someone who plays a good Winston, Orisa, or Zarya. We need versatile players that play good with a team and communicate well. If you’re interested I’m holding “try outs” tomorrow December 20th through December 22nd in order to register in time. If you’re interested just send me an email at seber.esp30@gmail.com and we can talk from there",1,"FALSE"
"434","Is it weird is rather be a manager than a player? ",-1,"TRUE"
"435","I wish there was a ""2018 Path to Fixing Toxicity"" instead of the focus on eSports that will amount to as much as Hearthstone and WoW.Blizzard needs to fix the game's social problems or they won't have a game for eSports.Edit:  And downvoted right on queue.  This game and sub needs to address the real problems addressing it instead of supporting enterprises that need their support through fostering a quality community.",0.2,"FALSE"
"436","Their are already games that are considered eSports atm that are cesspools, just look at:CS:GODota 2LoLThey are infamous for having terrible communities, doesn’t stop them from being a eSport or from hosting huge tournaments every year.Social problems won’t stop it.",-1,"TRUE"
"437","CS had a solid competitive community prior to GO.  It was a solid foundation that Hearthstone and WoW didn't have and couldn't create.DOTA as well (although it was usurped by Valve due to Blizzard's inaction and HOTS gameplay design).LoL is the only outlier and the biggest example of other companies trying to capture lightning in a bottle again.Even Blizzard couldn't build on the SC competitive scene for SC2 eSports.Fact of the matter is Blizzard is 0-3 (soon to be 0-4) on building their eSports brand.It's in the best interests of their franchises and communities to try to correct the social and gameplay problems within those enterprises.",0.636363636363636,"FALSE"
"438","All of Blizzards eSports endeavours are still very much viable and very much alive.Hearthstone, despite criticism, is still huge and tournaments have been happening ever since the game launched back in 2014, and Blizzard themselves have hosted the World Championships since 2015!WoW’s Arena scene, while small Il give you that, is still popular and while it isn’t as big as other Blizz eSports offerings, it still fills the arena at Blizzcon every year and has a sizeable backing to it, and that’s been going on since 2006!Starcraft is still huge, and while it hasn’t been in the mainstream for a while, it’s still one of the oldest and most popular eSports in the world, being publicly televised back in the early 2000’s well before CS got its footing, and Blizzard still continues to host the Finals at Blizzcon to a packed arena, and hundreds of thousands watch from home every year.Heroes follows a similar trend to WoW, but it still garners a following.Overwatch, while being new, usurped Starcraft as the main eSports game of Blizzcon 2017, taking over the main stage area that Starcraft has held for 10 years. It’s one of the most popular games in the world right now, and has had people playing it competitively since closed beta in early 2016.Calling Blizzards foray into eSports a total failure is completely wrong, and they have been doing it for longer.",0.333333333333333,"FALSE"
"439","even though its a 3rd party website its the closest thing to actual competitive https://www.ugcleague.com/index.cfm",1,"FALSE"
"440","This actually made me Lol . Nice one ",1,"FALSE"
"441","Don't listen to them dad. I'm your long lost son and I like Gengi. I need healing from being without a dad... ",0,"FALSE"
"442","Dissapointmen of a son cant spell Genji right. This is exactly why I lost you. ",0,"FALSE"
"443","Disappointment of a dad can’t spell Gengu! I expected more of you, Hanjo.",-1,"TRUE"
"444","Happy cake day!",1,"FALSE"
"445","Hey it's me, your son. I'd like a reinhardt gaming rig please. PM me for shipping details. ",1,"FALSE"
"446","We are going to have a problem here. ",-1,"TRUE"
"447","Y'all act like you never seen a young D.Va before,Mech all on the floor like your team just burst through the door,Started eating your ults like never before, gettin' a new high score and golds for sureIt's the return of the ""Oh wait, no way, you're kidding, she didn't just say GG while boosting into me, did she?""",1,"FALSE"
"448","I mean, as far as I understand it's sort of like ""dude"". When looking at things like these it's important to remember that the modern context isn't the same as that of the past. Just because a modern person might see some flirtation in it doesn't mean someone from the 60s will.",1,"FALSE"
"449","Well, that's probably why ""daddy-o"" died out.",0,"FALSE"
"450","Great idea!!",1,"FALSE"
"451","Wait what the fuck it can't be four days I have so much still left to buy ",-1,"TRUE"
"452","Yeah.  Sucks being broke, but seeing my nieces freak out is worth it.   ",-0.5,"TRUE"
"453","Here in germany we give the presents on christmas eve. So 2 days here. I can't find shit for my brother and am scared shitless.",-1,"TRUE"
"454","Here in the Netherlands we did that shit 17 days ago.",-1,"TRUE"
"455","Uhm hi I’d like to be your new daughter ",1,"FALSE"
"456","You're welcome daddy :) ",1,"FALSE"
"457","Is this easy mode?",1,"FALSE"
"458","Love, D. Va.",1,"FALSE"
"459","No Hacks Required",-1,"TRUE"
"460","I feel like OP is slowly regretting this post now. ",0,"FALSE"
"461","relevant flair",-1,"TRUE"
"462","Hell I'm dude, but I'll be his new daughter for a gaming PC.",-1,"TRUE"
"463","Well I have 3 daughters already, but I could use a son???  LoL",1,"FALSE"
"464","Hi, I'm still using the same PC since 2007 and it can't even run most games. Also I am boi. Let me be your son so I can disappoint twice my standard amount of dads.",-1,"TRUE"
"465","Oh this was the best morning laugh in a bit for me.  Well done, lol.",1,"FALSE"
"466","Yeah, he reeks of Sake, octopus ink, and regret. ",-1,"TRUE"
"467","Posts like these show me how trash I am at building PCs...",0,"FALSE"
"468","I'd wager yours is still better than a walmart prebuilt. besides, we don't have any info on what's inside that pink glowing thing and it's what's inside that counts :P",1,"FALSE"
"469","Hell have you seen the price on some of these lower end premades for Christmas? It's almost worth getting the $600 dollar one from Best Buy, just for the GPU and Ram, some are even coming with Ryzen 5s, and with the rise of crypto currency, it won't be long before a higher end GPU costs as much as a  decent build itself. ",0.5,"FALSE"
"470","Yeah, prebuilts have come a long way over the past few years. There's some nice deals if you shop around a bit.",1,"FALSE"
"471","In terms of hatdware my PC is indeed very good. But that only depends on how much one is willing to spend. When it comes to custom modding I am useless.",0.333333333333333,"FALSE"
"472","I mean OP's isn't that crazy. It's just a few DVa stickers pasted on a really nice tower and then a bunch of OW related gear, which as you said money can easily achieve.",0,"FALSE"
"473","It looks like a custom paint job to me, but hard to tell in the light.",0,"FALSE"
"474","Don't fret! ",-1,"TRUE"
"475","Yep, my 2005 rig was built by a friend, he asked me what case I wanted and I told him to go with what he thought looks best.  That pink case computer was with me until 2010!",1,"FALSE"
"476","You arent trash, you're great. Your pc's are trash though.",-0.333333333333333,"TRUE"
"477","What a rollercoaster of emotions. Would ride again.",-1,"TRUE"
"478","You’re great and I bet you build amazing PCs! Please, keep up the good work and don’t give up! &lt;3",1,"FALSE"
"479","better than xqc haha",1,"FALSE"
"480","Gahhh why doesn't the mouse have two extra buttons...I would snag that in a hot minute",0,"FALSE"
"481","I got that one, the mouse wheel is a little wobbly but other than that it's a great mouse for the price",1,"FALSE"
"482","Unfortunately tacky as heck, ""D.VA LOVE YOU"" is silly af too",-0.6,"TRUE"
"483","The mouse is way more expensive than the one he bought though. I know because I have the same one, it's the cheapest on Amazon",0,"FALSE"
"484","Yeah I too has the same mouse. It was actually pretty decent for its price",1,"FALSE"
"485","What the actual fuck is this ",-1,"TRUE"
"486","That name is adorable tho ",1,"FALSE"
"487","This is not okay. Like the trans thing is fine. But the whole thinking they're six thing is definitely not okay.",1,"FALSE"
"488","Thanks so much. You are an awesome dad, I wished for the same thing but they said no sadly",0,"FALSE"
"489","Thank you, that means a lot!  I'm sorry you did not get what you wished for. . . hopefully you will one day!  ",0,"FALSE"
"490","Awesome build, got the specs? Also you need to do a reaction video",1,"FALSE"
"491","Everybody loves D.Va.",1,"FALSE"
"492","You sure the monitor will not degrade from heat in this coat?",-1,"TRUE"
"493","That thing is really cool, I've never seen something like that before!",1,"FALSE"
"494","Neat, was wondering about that when I saw the setup too. Awesome job. I hope in 9 years to be doing something similar with my first daughter.",1,"FALSE"
"495","It's like that home renovation show, you tell them you like cars and suddenly you sleep in a garage",1,"FALSE"
"496","This is so cool, hope she loves it. Don't let her snack near the PC... or in the Meka!",1,"FALSE"
"497","Damn you are a good dad,your daughter is lucky.",0.333333333333333,"FALSE"
"498","That's a cool fucking PC. Well parented!",0.333333333333333,"FALSE"
"499","As a Dva main, I approve.",1,"FALSE"
"500","Yay!",1,"FALSE"
"501","A dad like OP.",1,"FALSE"
"502","Right in the feels",1,"FALSE"
"503","Be sure to do some good parenting regarding voice chat, if she hasn't played the game before. Folks can get pretty toxic toward females. ",0.333333333333333,"FALSE"
"504","Yeah I need to figure out all that, as I've not had to mute global chat and such (is there a way?) not sure how I'm gonna filter all the filth out.  Luckily her desk I built beside mine, lol.",-1,"TRUE"
"505","You can change a setting in the gameplay tab i think to automatically opt out of voice chat as the game begins. I've had it on for quite a while and it's made me enjoy the game a lot more.",1,"FALSE"
"506","been playing ow at plat across all seasons on pc and ps4 as a female, i can only name about 3 incidents where men have acted creepy towards me or degraded me for being a girl. a lot of those times its just teenage boys looking to blame someone for a loss. most of the time guys dont care and will only say ""oh we have a girl here"" and thats the end of it. just wanted to say that its not as terrible as people make it seem to be especially compared to other online games and communities.",-1,"TRUE"
"507","Oh man, that's awesome! The case looks great. I hope you two have a great time playing together!  :) ",1,"FALSE"
"508","Pretty cool build, dude, she's a lucky girl! :D Just a tip, please make sure the monitor doesn't get so warm that it might start a fire with the fluff around it. Some monitors can get really warm on top\back of the unit. The D.Va fluff might act as insulation and amplify this and get dangerous. Nobody needs a house fire during Christmas. :)  Stay safe!",0.75,"FALSE"
"509","You're gonna regret it when she beats you 1v1 later lul /s",-1,"TRUE"
"510","A D.Va/Rein 1v1 sounds super scary, haha!",0,"FALSE"
"511","Rein :)  Gotta protect her...always.",1,"FALSE"
"512","That is the cutest thing I’ve ever read. You’re a great father! ",1,"FALSE"
"513","Don't forget to play to win",1,"FALSE"
"514","Omg I love this. I'm a Dva fan. She'll love this for sure!!! ",1,"FALSE"
"515","That's amazing! I only got a headset for my 5-year-old who loves OW, but maybe one day I'll build him a PC too. :) He loves Bastion, I bet that'd make for an amazing custom PC theme hahah",1,"FALSE"
"516","This is adorable. I'm a grown ass woman and I want it",1,"FALSE"
"517","What kind of monster posts a pc build without a parts list???  Edit it into the original post!!",-1,"TRUE"
"518","Good call. . . done!  &lt;3",1,"FALSE"
"519","I’m all for customizing PC’s and such but have always thought it weird to do certain games because if you get bored of it it’s a constant reminder. Still cool tho. ",-0.333333333333333,"TRUE"
"520","People generally remember characters fondly even if they tire of playing the game, though",1,"FALSE"
"521","Could always get it reskinned and replace the mousepad if she really wanted to change it. Probably not too much of a hassle",-1,"TRUE"
"522","Your like, the coolest fucking mom ever.",0.333333333333333,"FALSE"
"523","I'm a Dad, but thank you. . . means a lot!",1,"FALSE"
"524","So you're LIKE the coolest mom ever. <U+653C><U+3E64><U+613C><U+3E30><U+623C><U+3E64><U+653C><U+3E64><U+623C><U+3E38><U+383C><U+3E39>",1,"FALSE"
"525","The fact that you're a dad makes being the coolest mom ever an even more impressive feat",1,"FALSE"
"526","Apevia Mirage-X Tempered Glass version :)",-1,"TRUE"
"527","Very cool! I have my first daughter on the way. How did you introduce her to video games? ",1,"FALSE"
"528","Well she just naturally obtained interest through seeing me and my wife play and first got into gaming with easy stuff like Mario/Little Big Planet.   I never forced it. . just hooked up some systems in the play room and let her and her sisters experiment with the games and controls.  I remember as a child playing an NES over and over until you just either loved the journey or hated the experience. . . I'm thankful we both love the journey :)",0.714285714285714,"FALSE"
"529","Awesome parent!  Also, D.Va is amazing.  Gj mom or dad. ",1,"FALSE"
"530","Yay a new dva main!!!!!Welcome to the club!",1,"FALSE"
"531","hella dope",-1,"TRUE"
"532","Really nice of you. I like the ambience as well:)Have fun, although I'm sure you can't queue with her cause she is better than you xdxd",1,"FALSE"
"533","This is wonderful ",1,"FALSE"
"534","This is just great parenting! Keep it up! Merry Christmas :)",1,"FALSE"
"535","holy shit. nice job!",0.333333333333333,"FALSE"
"536","MERRY CHRISTMAS,and that looks fucking amazing.  ",0.333333333333333,"FALSE"
"537","Ahhhh it's so gorgeous! Also I have legit never seen a mousepad like this. That's pretty nice, I need a new one too.",1,"FALSE"
"538","Wow! You are a really nice dad!",1,"FALSE"
"539","that's sick dude. Your daughter is lucky to have such a good father. Merry Christmas. ",0.5,"FALSE"
"540","I'm so jealous",-1,"TRUE"
"541","That’s so sweet! Cheers to you and your daughter! ",1,"FALSE"
"542","I’m a grown man and I love d.va can I be your daughter? ",1,"FALSE"
"543","You're actually the best dad in history ",1,"FALSE"
"544","This looks really really good! Nice job! Wish my dad would do this hahah. Merry Christmas to you and your family! ",1,"FALSE"
"545","Well, you and your daughter are awesome and she have good taste in character :). Merry early Christmas to you 2.",1,"FALSE"
"546","So jealous! This is amazing! She’ll love it!!!! ",0.333333333333333,"FALSE"
"547","Hey, it's me your husband, Moira gaming PC please. Thanks. Im super broke and want a Christmas present. ",0,"FALSE"
"548","Can I be your daughter.... Sure I'm a man.. And grown.. But still my hard drive is dying and I'm willing to act. ",-0.333333333333333,"TRUE"
